{
  "schema_version": "1.0.0-draft",
  "synthetic": true,
  "run": {
    "date": "2026-09-25",
    "method_version": "2026-09-25",
    "ranking_toml_sha256": "66dab0fd9a4c7adea63aebe6f8ed2970c7af49defbd9fda7f8ec0531c01f9453",
    "generator": "synthetic sample (hand-made, not a pipeline run)"
  },
  "data_license": {"spdx": "CC-BY-SA-4.0", "provisional": false, "url": "https://creativecommons.org/licenses/by-sa/4.0/"},
  "views": [
    {"key": "overall", "label": "Overall", "measures": "Desktop installs people chose and use in sites, code and apps, half each.", "available": true},
    {
      "key": "desktop_chosen",
      "label": "Desktop: most chosen",
      "measures": "Fonts people install on purpose. Fonts that Linux systems install on their own are ranked on their other sources.",
      "available": true
    },
    {"key": "desktop_installed", "label": "Desktop: most installed", "measures": "Fonts on the most computers, counting every install.", "available": true},
    {"key": "project", "label": "Used in projects", "measures": "Use in websites (55%), code (30%) and apps (15%).", "available": true},
    {"key": "coding", "label": "Coding fonts", "measures": "Monospace fonts, ranked by developers' installs and downloads.", "available": true},
    {
      "key": "dev_apps",
      "label": "Developers & apps",
      "measures": "What builders choose: npm packages, projects that depend on them, and app frameworks.",
      "available": true
    },
    {"key": "rising", "label": "Rising (beta)", "measures": "Fonts gaining share over the last 3 months.", "available": false}
  ],
  "bands": [{"label": "101–250", "from": 101, "to": 250}, {"label": "251–500", "from": 251, "to": 500}, {"label": "501+", "from": 501, "to": null}],
  "tiers": {
    "A": "Firm: evidence from at least 2 kinds of source, and the rank is unlikely to move far.",
    "B": "Fair: the rank could move by about its own size.",
    "C": "Rough: thin or conflicting evidence."
  },
  "sources": [
    {
      "id": "homebrew",
      "name": "Homebrew cask installs",
      "group": "homebrew",
      "survey": "desktop",
      "measures": "Font cask installs on macOS over 365 days",
      "url": "https://formulae.brew.sh/analytics/",
      "license": "No data license stated; counts may be published, with credit",
      "data_date": "2026-09-24",
      "stale": false,
      "publish_rank": true
    },
    {
      "id": "arch",
      "name": "Arch Linux pkgstats",
      "group": "arch",
      "survey": "desktop",
      "measures": "Share of Arch Linux systems with each font package, 12-month mean",
      "url": "https://pkgstats.archlinux.de",
      "license": "No data license stated; counts may be published, with credit",
      "data_date": "2026-09-01",
      "stale": false,
      "publish_rank": true
    },
    {
      "id": "debian",
      "name": "Debian popularity contest",
      "group": "debian",
      "survey": "desktop",
      "measures": "Installs reported by Debian-based systems",
      "url": "https://popcon.debian.org",
      "license": "MIT (Expat) or GPL-2.0-or-later, per Debian's web license",
      "data_date": "2026-09-24",
      "stale": false,
      "publish_rank": true
    },
    {
      "id": "github",
      "name": "GitHub release downloads",
      "group": "github_counters",
      "survey": "desktop",
      "measures": "Downloads of fonts whose main channel is GitHub releases",
      "url": "https://docs.github.com/en/rest/releases",
      "license": "Counts may be published, with credit (GitHub Terms of Service)",
      "data_date": "2026-07-24",
      "stale": true,
      "publish_rank": true
    },
    {
      "id": "nerd",
      "name": "Nerd Fonts release downloads",
      "group": "github_counters",
      "survey": "desktop",
      "measures": "Patched-build downloads, credited to the original font",
      "url": "https://github.com/ryanoasis/nerd-fonts/releases",
      "license": "Counts may be published, with credit (GitHub Terms of Service)",
      "data_date": "2026-09-24",
      "stale": false,
      "publish_rank": true
    },
    {
      "id": "fot",
      "name": "Fonts Over Time",
      "group": "fot",
      "survey": "project",
      "measures": "Fonts used on about 10,000 homepages",
      "url": "https://fontsovertime.com",
      "license": "Used with credit and a link back, as its data page asks; only ranks are published",
      "data_date": "2026-09-21",
      "stale": false,
      "publish_rank": true
    },
    {
      "id": "almanac",
      "name": "Web Almanac 2025",
      "group": "http_archive",
      "survey": "project",
      "measures": "Pages declaring each font, top 100 families",
      "url": "https://almanac.httparchive.org",
      "license": "Apache-2.0",
      "data_date": "2025-07-01",
      "stale": false,
      "publish_rank": true
    },
    {
      "id": "google",
      "name": "Google Fonts views",
      "group": "google",
      "survey": "project",
      "measures": "Views served by Google Fonts over one year",
      "url": "https://fonts.google.com",
      "license": "Used for ranks only; view counts are not published (Google Terms of Service)",
      "data_date": "2026-09-24",
      "stale": false,
      "publish_rank": true
    },
    {
      "id": "npm_fontsource",
      "name": "npm downloads of Fontsource packages",
      "group": "npm_registry",
      "survey": "project",
      "measures": "Downloads of @fontsource and @fontsource-variable packages over one year",
      "url": "https://www.npmjs.com/org/fontsource",
      "license": "No data license stated; counts may be published, with credit",
      "data_date": "2026-09-24",
      "stale": false,
      "publish_rank": true
    },
    {
      "id": "ecosystems",
      "name": "ecosyste.ms dependent repositories",
      "group": "npm_registry",
      "survey": "project",
      "measures": "GitHub projects that declare each Fontsource package",
      "url": "https://packages.ecosyste.ms",
      "license": "CC-BY-SA-4.0",
      "data_date": "2026-09-23",
      "stale": false,
      "publish_rank": true
    },
    {
      "id": "jsdelivr",
      "name": "jsDelivr hits, through Fontsource",
      "group": "jsdelivr",
      "survey": "project",
      "measures": "CDN requests for each Fontsource package",
      "url": "https://www.jsdelivr.com",
      "license": "No data license stated; counts may be published, with credit",
      "data_date": "2026-09-24",
      "stale": false,
      "publish_rank": false
    },
    {
      "id": "npm_expo",
      "name": "npm downloads of Expo Google Fonts",
      "group": "npm_registry",
      "survey": "project",
      "measures": "Downloads of @expo-google-fonts packages over one year",
      "url": "https://www.npmjs.com/org/expo-google-fonts",
      "license": "No data license stated; counts may be published, with credit",
      "data_date": "2026-09-24",
      "stale": false,
      "publish_rank": true
    }
  ],
  "systems": [
    {"id": "windows-11", "label": "Windows 11", "os": "windows"},
    {"id": "macos", "label": "macOS", "os": "macos"},
    {"id": "android", "label": "Android", "os": "android"},
    {"id": "debian", "label": "Debian", "os": "linux"},
    {"id": "fedora", "label": "Fedora", "os": "linux"},
    {"id": "gnome", "label": "GNOME", "os": "linux"},
    {"id": "endeavouros", "label": "EndeavourOS", "os": "linux"},
    {"id": "cachyos", "label": "CachyOS", "os": "linux"}
  ],
  "license_classes": [
    {"id": "open-font", "label": "Open font licenses (OFL, UFL, Bitstream Vera)"},
    {"id": "permissive", "label": "Permissive (Apache, MIT, BSD, CC0)"},
    {"id": "attribution", "label": "Attribution required (CC BY)"},
    {"id": "freeware", "label": "Other free-use grants"}
  ],
  "fonts": [
    {
      "id": "sample-sans-01",
      "family": "Sample Sans 01",
      "category": "sans-serif",
      "is_monospace": false,
      "formats": {"variable": true, "static": true},
      "latin": {"coverage": "extended", "basis": "gf_metadata"},
      "license": {
        "spdx": "OFL-1.1",
        "name": "SIL Open Font License 1.1",
        "class": "open-font",
        "redistributable": true,
        "attribution_required": false,
        "attribution": null,
        "text_url": "https://raw.githubusercontent.com/google/fonts/23e54b51ddffbc7713c583748e3bd86f62b1fa4a/ofl/inter/OFL.txt"
      },
      "preview_ok": true,
      "preview": {"path": "specimens/sample-sans-01.svg", "sha256": "0000000000000000000000000000000000000000000000000000000000000000"},
      "font_file": {
        "url": "https://raw.githubusercontent.com/google/fonts/23e54b51ddffbc7713c583748e3bd86f62b1fa4a/ofl/inter/Inter%5Bopsz%2Cwght%5D.ttf",
        "sha256": "29160a80ff49ddcab2c97711247e08b1fab27a484a329ce8b813d820dc559031",
        "size": 876576,
        "format": "ttf"
      },
      "links": {"primary": {"url": "https://github.com/rsms/inter"}, "designer": {"url": "https://rsms.me/", "label": "Rasmus Andersson"}},
      "preinstalled_on": [],
      "pulled_in_by": [],
      "aliases": [{"name": "Sample Sans 01 Variable", "relation": "build"}, {"name": "SampleSans01-Regular", "relation": "postscript"}],
      "first_seen": "2025-02-02",
      "flags": [],
      "ranks": {
        "overall": {"rank": 1, "band": null, "order": 1, "tier": "A", "range": [1, 6], "gate_held": false, "unranked": null},
        "desktop_chosen": {"rank": 3, "band": null, "order": 3, "tier": "A", "range": [1, 8], "gate_held": false, "unranked": null},
        "desktop_installed": {"rank": 3, "band": null, "order": 3, "tier": "A", "range": [1, 8], "gate_held": false, "unranked": null},
        "project": {"rank": 1, "band": null, "order": 1, "tier": "A", "range": [1, 6], "gate_held": false, "unranked": null},
        "dev_apps": {"rank": 2, "band": null, "order": 2, "tier": "A", "range": [1, 7], "gate_held": false, "unranked": null}
      },
      "sources": {